{
  "task_id": "LANGUAGE-LEARNING-APP-MASTER-PROJECT-CANON-AND-EXECUTION-READINESS-002D",
  "verdict": "ACCEPTED",
  "managed_product_closed": true,
  "marketing_strategy_complete": true,
  "commercial_model_complete": true,
  "roadmap_complete": true,
  "deadlines_complete": true,
  "budgets_complete": true,
  "stage_acceptance_complete": true,
  "fundamental_documentation_layers_remaining": 0,
  "next_allowed_action": "FIRST-MVP-VERTICAL-SLICE-IMPLEMENTATION-003",
  "real_ai_allowed": false,
  "staging_allowed": false,
  "production_accepted": false
}